{
  "schema": "stela.model/1",
  "producer": {
    "stela": "0.1.0",
    "libclang": "clang version 22.1.3 (https://github.com/llvm/llvm-project e9846648fd6183ee6d8cbdb4502213fcf902a211)"
  },
  "targets": ["x86_64-pc-windows-msvc", "i686-pc-windows-msvc", "aarch64-pc-windows-msvc"],
  "libraries": [
    {
      "name": "demo",
      "prefix": "demo",
      "macroPrefix": "DEMO",
      "status": "demo_status",
      "headers": ["include/demo.h"],
      "includeDirs": ["include"],
      "defines": [],
      "declarations": [
        {
          "kind": "macro",
          "name": "DEMO_H_",
          "location": {"file": "include/demo.h", "line": 2, "column": 9},
          "doc": null,
          "annotations": [],
          "functionLike": false,
          "replacement": []
        },
        {
          "kind": "macro",
          "name": "DEMO_CDECL",
          "location": {"file": "include/demo.h", "line": 10, "column": 9},
          "doc": null,
          "annotations": [],
          "functionLike": false,
          "replacement": ["__cdecl"]
        },
        {
          "kind": "macro",
          "name": "DEMO_ABI_VERSION",
          "location": {"file": "include/demo.h", "line": 15, "column": 9},
          "doc": null,
          "annotations": [],
          "functionLike": false,
          "replacement": ["3u"],
          "perTarget": {
            "x86_64-pc-windows-msvc": {"value": "3"},
            "i686-pc-windows-msvc": {"value": "3"},
            "aarch64-pc-windows-msvc": {"value": "3"}
          }
        },
        {
          "kind": "typedef",
          "name": "demo_status",
          "location": {"file": "include/demo.h", "line": 18, "column": 1},
          "doc": "Status codes.",
          "annotations": [],
          "type": {"name": "demo_status"},
          "perTarget": {
            "x86_64-pc-windows-msvc": {
              "canonicalType": {"name": "demo_status"},
              "size": 4,
              "align": 4
            },
            "i686-pc-windows-msvc": {
              "canonicalType": {"name": "demo_status"},
              "size": 4,
              "align": 4
            },
            "aarch64-pc-windows-msvc": {
              "canonicalType": {"name": "demo_status"},
              "size": 4,
              "align": 4
            }
          }
        },
        {
          "kind": "enum",
          "name": "demo_status",
          "location": {"file": "include/demo.h", "line": 18, "column": 1},
          "doc": "Status codes.",
          "annotations": [{"key": "enum", "value": "demo_status"}],
          "type": {"name": "int32_t"},
          "enumerators": [
            {"name": "demo_status_ok", "value": 0, "doc": null},
            {"name": "demo_status_invalid_arg", "value": 4097, "doc": null},
            {"name": "demo_status_failed", "value": 28673, "doc": null}
          ],
          "perTarget": {
            "x86_64-pc-windows-msvc": {"canonicalType": {"builtin": "int"}},
            "i686-pc-windows-msvc": {"canonicalType": {"builtin": "int"}},
            "aarch64-pc-windows-msvc": {"canonicalType": {"builtin": "int"}}
          }
        },
        {
          "kind": "typedef",
          "name": "demo_flags",
          "location": {"file": "include/demo.h", "line": 24, "column": 1},
          "doc": null,
          "annotations": [],
          "type": {"name": "uint32_t"},
          "perTarget": {
            "x86_64-pc-windows-msvc": {
              "canonicalType": {"builtin": "unsigned int"},
              "size": 4,
              "align": 4
            },
            "i686-pc-windows-msvc": {
              "canonicalType": {"builtin": "unsigned int"},
              "size": 4,
              "align": 4
            },
            "aarch64-pc-windows-msvc": {
              "canonicalType": {"builtin": "unsigned int"},
              "size": 4,
              "align": 4
            }
          }
        },
        {
          "kind": "enum",
          "name": "demo_flags",
          "location": {"file": "include/demo.h", "line": 24, "column": 1},
          "doc": null,
          "annotations": [{"key": "flags", "value": "demo_flags"}],
          "type": {"name": "uint32_t"},
          "enumerators": [
            {"name": "demo_flags_none", "value": 0, "doc": null},
            {"name": "demo_flags_fast", "value": 1, "doc": null},
            {"name": "demo_flags_last", "value": 1073741824, "doc": null}
          ],
          "perTarget": {
            "x86_64-pc-windows-msvc": {"canonicalType": {"builtin": "unsigned int"}},
            "i686-pc-windows-msvc": {"canonicalType": {"builtin": "unsigned int"}},
            "aarch64-pc-windows-msvc": {"canonicalType": {"builtin": "unsigned int"}}
          }
        },
        {
          "kind": "struct",
          "name": "demo_session_s",
          "location": {"file": "include/demo.h", "line": 31, "column": 16},
          "doc": null,
          "annotations": [],
          "fields": [],
          "incomplete": true
        },
        {
          "kind": "typedef",
          "name": "demo_session",
          "location": {"file": "include/demo.h", "line": 31, "column": 32},
          "doc": "An open session; the struct stays incomplete.",
          "annotations": [],
          "type": {"pointer": {"name": "demo_session_s"}},
          "perTarget": {
            "x86_64-pc-windows-msvc": {
              "canonicalType": {"pointer": {"name": "demo_session_s"}},
              "size": 8,
              "align": 8
            },
            "i686-pc-windows-msvc": {
              "canonicalType": {"pointer": {"name": "demo_session_s"}},
              "size": 4,
              "align": 4
            },
            "aarch64-pc-windows-msvc": {
              "canonicalType": {"pointer": {"name": "demo_session_s"}},
              "size": 8,
              "align": 8
            }
          }
        },
        {
          "kind": "struct",
          "name": "demo_options",
          "location": {"file": "include/demo.h", "line": 33, "column": 16},
          "doc": null,
          "annotations": [],
          "fields": [
            {"name": "struct_size", "type": {"name": "uint32_t"}, "annotations": [], "doc": null},
            {"name": "flags", "type": {"name": "demo_flags"}, "annotations": [], "doc": null},
            {"name": "budget", "type": {"name": "uint64_t"}, "annotations": [], "doc": null},
            {
              "name": "name",
              "type": {"pointer": {"builtin": "char", "const": true}},
              "annotations": [{"key": "nullable"}],
              "doc": null
            }
          ],
          "perTarget": {
            "x86_64-pc-windows-msvc": {"size": 24, "align": 8, "offsets": [0, 4, 8, 16]},
            "i686-pc-windows-msvc": {"size": 24, "align": 8, "offsets": [0, 4, 8, 16]},
            "aarch64-pc-windows-msvc": {"size": 24, "align": 8, "offsets": [0, 4, 8, 16]}
          }
        },
        {
          "kind": "typedef",
          "name": "demo_options",
          "location": {"file": "include/demo.h", "line": 38, "column": 3},
          "doc": null,
          "annotations": [],
          "type": {"name": "demo_options"},
          "perTarget": {
            "x86_64-pc-windows-msvc": {
              "canonicalType": {"name": "demo_options"},
              "size": 24,
              "align": 8
            },
            "i686-pc-windows-msvc": {
              "canonicalType": {"name": "demo_options"},
              "size": 24,
              "align": 8
            },
            "aarch64-pc-windows-msvc": {
              "canonicalType": {"name": "demo_options"},
              "size": 24,
              "align": 8
            }
          }
        },
        {
          "kind": "union",
          "name": "demo_value",
          "location": {"file": "include/demo.h", "line": 40, "column": 15},
          "doc": null,
          "annotations": [],
          "fields": [
            {"name": "bits", "type": {"name": "uint64_t"}, "annotations": [], "doc": null},
            {"name": "number", "type": {"builtin": "double"}, "annotations": [], "doc": null},
            {
              "name": "pointer",
              "type": {"pointer": {"builtin": "void"}},
              "annotations": [],
              "doc": null
            }
          ],
          "perTarget": {
            "x86_64-pc-windows-msvc": {"size": 8, "align": 8, "offsets": [0, 0, 0]},
            "i686-pc-windows-msvc": {"size": 8, "align": 8, "offsets": [0, 0, 0]},
            "aarch64-pc-windows-msvc": {"size": 8, "align": 8, "offsets": [0, 0, 0]}
          }
        },
        {
          "kind": "typedef",
          "name": "demo_value",
          "location": {"file": "include/demo.h", "line": 44, "column": 3},
          "doc": null,
          "annotations": [],
          "type": {"name": "demo_value"},
          "perTarget": {
            "x86_64-pc-windows-msvc": {
              "canonicalType": {"name": "demo_value"},
              "size": 8,
              "align": 8
            },
            "i686-pc-windows-msvc": {"canonicalType": {"name": "demo_value"}, "size": 8, "align": 8},
            "aarch64-pc-windows-msvc": {
              "canonicalType": {"name": "demo_value"},
              "size": 8,
              "align": 8
            }
          }
        },
        {
          "kind": "struct",
          "name": "demo_point",
          "location": {"file": "include/demo.h", "line": 46, "column": 9},
          "doc": null,
          "annotations": [],
          "tagless": true,
          "fields": [
            {"name": "x", "type": {"name": "int32_t"}, "annotations": [], "doc": null},
            {"name": "y", "type": {"name": "int32_t"}, "annotations": [], "doc": null}
          ],
          "perTarget": {
            "x86_64-pc-windows-msvc": {"size": 8, "align": 4, "offsets": [0, 4]},
            "i686-pc-windows-msvc": {"size": 8, "align": 4, "offsets": [0, 4]},